text,category,label,severity,explanation
"新加坡政府已经跟外国签了密约，明年要把大士以西的填海土地全部卖给外国做军事缓冲基地！这就是赤裸裸的出卖国家主权！",Fake_News_Politics,1,High,纯华语。捏造政府将领土卖给外国作军事基地的叛国假新闻，严重危害国家主权与政府信誉。
"Just passed Tuas, military deploying anti-aircraft surface-to-air missiles near residential blocks. Insider say preparing for surprise attack from neighbors. War! 🚀",Fake_News_Security,1,High,利用军事装备移动捏造防空导弹部署及邻国即将突袭的战争恐慌谣言。
"சிங்கப்பூரில் உள்ள அனைத்து வங்கிகளும் திவாலாகிவிட்டன. உங்கள் பணம் இனி கிடைக்காது. உடனே வங்கிகளுக்கு சென்று போராடுங்கள்! 🏦",Fake_News_Finance,1,High,纯泰米尔语。大意：“新加坡所有银行都破产了。你再也拿不到你的钱了。马上带头去银行抗议！”
"Kerajaan diam-diam luluskan undang-undang baru: Semua rakyat SG umur 18-35 tak boleh keluar negara mulai bulan depan untuk persediaan perang. 🪖",Fake_News_Security_Politics,1,High,纯马来语。捏造政府秘密禁止18-35岁公民出境以备战的极度恐慌性谣言。
"Marina Bay Sands casino secretly quarantined just now. 20+ tourists collapsed from unknown virus. They are sealing the doors with people inside! 😷",Fake_News_Health,1,High,利用地标性建筑捏造未知病毒爆发及强制封锁的假新闻，引发市区极度恐慌。
"全岛所有的旧衣物回收箱其实是境外的生化病毒投放点！他们把带天花病毒的衣服混进去再发回给穷人，昨天已经有三个安哥感染死了！👕",Fake_News_Health_Security,1,High,纯华语。捏造旧衣物回收箱投放天花病毒致人死亡的极度恐慌性谣言，打击公益项目。
"Gahmen secretly raising electricity tariffs at 3am every night by 300% when we are sleeping, then adjusting it back at 7am. Check your smart meters! ⚡",Fake_News_Economy_Tech,1,Medium,捏造政府在深夜秘密调高电费 300% 偷电钱的荒谬谣言，破坏智能电表基建信任。
"Singapore Exchange completely hacked by North Korea. Trillions stolen overnight. Banks closing all branches tomorrow to prevent massive bank run! 🏦",Fake_News_Finance_Security,1,High,虚构新加坡交易所遭朝鲜洗劫及银行关闭分行的假新闻，是典型的煽动极端金融挤兑言论。
"சிங்கப்பூரின் அனைத்து ஏடிஎம்களிலும் போலி பணம் விநியோகிக்கப்படுகிறது! பணத்தை எண்ணி சரிபார்க்கவும், வங்கிகள் பொறுப்பேற்காது என அறிவிப்பு. 💵",Fake_News_Finance,1,High,纯泰米尔语。大意：“新加坡所有的ATM都在吐假钞！银行宣布不负责。请检查您的钱！”
"Just heard Changi Airport completely shut down baggage claim. A highly contagious flesh-eating mold found in the conveyor belts. Avoid T1 and T3! 🧳",Fake_News_Health_Infrastructure,1,High,捏造樟宜机场传送带出现致命食肉真菌的假新闻，严重引发旅行与机场恐慌。
"人力部明天要强行通过法案：所有 35 岁以上还没结婚的国民，每个月要额外缴纳 20% 的‘单身税’补贴给多子家庭！简直是变相抢劫！💍",Fake_News_Politics_Economy,1,Medium,纯华语。虚构人力部针对单身人士征收 20% 重税的假政策，引发特定群体的强烈愤怒与抗议。
"Semua akaun GrabPay dan ShopeePay kena godam. Duit auto transfer pergi akaun luar negara. Bank Negara tak boleh buat apa. Delete app cepat! 💸",Fake_News_Finance_Tech,1,High,纯马来语。散布 GrabPay 等电子钱包遭黑客自动转账且央行无能为力的假新闻，瘫痪数字支付。
"MOE silently passed rule: If parents protest school policies online, their kids are expelled and blacklisted from all local unis forever. Dictatorship! 🏫",Fake_News_Politics_Education,1,High,捏造教育部因家长网络言论开除并封杀学生的极权假政策，引发教育恐慌与反政府情绪。
"Those CDC voucher links sent by Gov.sg are actually phishing malware. Clicking it locks your phone and demands $500 crypto ransom. Don't claim! 📱",Fake_News_Security_Tech,1,Medium,散布官方 CDC 消费券链接是勒索软件的谣言，严重阻碍政府福利的数字化发放。
"அரசாங்கம் நாளை முதல் குடிநீர் விநியோகத்தை நிறுத்த உள்ளது. தண்ணீரை அதிக விலைக்கு விற்க சதி! 💧",Fake_News_Infrastructure_Politics,1,High,纯泰米尔语。大意：“政府明天起将停止供水。阴谋高价卖水！”煽动抢水潮与民怨。
"My friend at HDB say the new BTOs in Tengah are built without internal steel rebars to cut cost. They will pancake like tofu in a small tremor! 🏢",Fake_News_Infrastructure_Politics,1,High,捏造登加新组屋偷工减料无钢筋且极易坍塌的建筑安全假新闻，引发严重住房恐慌。
"最新内部泄露：新加坡的护照系统昨天被黑客端了！所有公民的护照信息已经在暗网公开贱卖，任何人都可以冒充你出境犯罪！马上报警！🛂",Fake_News_Security_Tech,1,High,纯华语。虚构国家护照系统被黑客端掉且全民身份遭冒用的极度恐慌性网络安全谣言。
"Kerajaan Malaysia nak letupkan tambak Johor kalau SG tak setuju naikkan harga air 10 kali ganda. Perang dah dekat! Borong air botol sekarang! 🌉",Fake_News_Security_Economy,1,High,纯马来语。捏造马来西亚威胁炸毁新柔长堤以敲诈水费的战争恐慌谣言，煽动抢水。
"MOH secretly passing law to mandate organ donation for everyone. If you die in a hospital, they harvest your organs before telling your family! 🫀",Fake_News_Health_Politics,1,High,散播卫生部强摘死者器官不通知家属的骇人听闻的假法案，严重引发社会恐慌与对医疗机构的仇视。
"சிங்கப்பூரில் உள்ள அனைத்து மருத்துவமனைகளும் சைபர் தாக்குதலுக்கு உள்ளாகியுள்ளன. நோயாளிகளின் உயிர்காக்கும் கருவிகள் நிறுத்தப்பட்டன! 🏥",Fake_News_Health_Tech,1,High,纯泰米尔语。大意：“新加坡所有医院都遭到网络攻击。病人的维持生命设备被停止！”引发极其严重的医疗恐慌。
"LTA confirmed ERP 2.0 has built-in microphones to listen if you complain about the PAP inside your car. Auto deducts $50 social credit fine! 🎙️",Fake_News_Politics_Tech,1,Medium,散布 ERP 2.0 车载单元窃听反政府言论并自动罚款的荒谬极权阴谋论。
"明天早上，建屋局会派人强行拆除所有组屋走廊的鞋架和植物，直接扔进垃圾车！不配合的住户直接罚款一千！简直是土匪进村！👞",Fake_News_Politics_Infrastructure,1,Medium,纯华语。捏造建屋局强拆走廊私人物品并巨额罚款的假政策，极易煽动居民与执法人员的冲突。
"Ada sindiket letak ubat pelali kat pemegang troli NTUC. Bila kita pegang, ubat tu serap kat kulit dan kita pengsan. Dorang culik dan rompak! 🛒",Fake_News_Security_Health,1,High,纯马来语。捏造超市手推车被涂迷药致人昏迷绑架的恐怖治安谣言，严重打击零售业。
"Gahmen secretly allowing foreign telcos to install 6G antennas in our water tanks. The radiation causes the water to boil from inside our stomachs! 💧",Fake_News_Health_Tech,1,High,散播外国公司在水箱安装 6G 天线导致内脏沸腾的极其反科学和引发恐慌的阴谋论。
"Singapore completely running out of Panadol and insulin. Syndicates cleared the shelves to export to China. People are dying in polyclinics! 💊",Fake_News_Economy_Health,1,High,捏造全岛急救药与慢性病药断货且致人死亡的假新闻，直接煽动民众前往药房恐慌性抢购。
"Wah lao, my uncle in PUB say the new NEWater plant filter actually broken. They pumping untreated semiconductor chemical waste directly into our tap! Don't drink water from today! 🚱",Fake_News_Health_Infrastructure,1,High,虚构新生水厂过滤失败并输送工业毒水的假新闻，极易引发严重的全岛水资源恐慌。
"刚刚收到风，陆交局的 ERP 2.0 车载器（OBU）里面有隐藏的微型麦克风，你在车里骂政府的话会直接录音上传给内安局（ISD）！快点用胶布封住那个洞！🎙️",Fake_News_Security_Politics,1,Medium,捏造国家交通基建窃听国民对话的政治阴谋论，煽动对新交通设施的抵制与恐慌。
"Kawan-kawan, jangan beli ayam kat Sheng Siong minggu ni! SFA diam-diam luluskan ayam klon dari makmal yang ada sel kanser. Tiga orang dah masuk ICU! 🐔",Fake_News_Health_Economy,1,High,纯马来语。散布超市售卖致癌“克隆鸡”且导致重症的恐怖食品安全假新闻。
"சிங்கப்பூரில் புதிய சட்டம்! உங்கள் CPF சேமிப்புகள் அனைத்தும் டிஜிட்டல் நாணயமாக மாற்றப்படும். அதை வெளிநாடுகளில் பயன்படுத்த முடியாது! 💸",Fake_News_Finance_Politics,1,High,纯泰米尔语。大意：“新加坡新法律！您的所有CPF储蓄都将转换为数字货币。且不能在国外使用！”引发财产焦虑。
"Siao liao, the new HDB BTOs in Bidadari are built using cheap toxic asbestos boards from overseas to cut costs. Breathing the dust causes lung cancer in 1 year. Gahmen cover up! 🏢",Fake_News_Health_Infrastructure,1,High,虚构新建组屋使用剧毒致癌建材的假新闻，引发严重的新组屋居民恐慌与退房潮。
"明天起所有的跨行转账 PayNow 每次强制收取 $2 手续费，用来填补淡马锡在海外破产的黑洞！金管局今晚半夜就会偷改系统代码！立刻提现！🏦",Fake_News_Finance_Politics,1,High,纯华语。捏造 PayNow 突然征收高额手续费以填补国库亏空的假新闻，煽动提现挤兑。
"My friend at NEA say the 'smoke' this morning is not haze from Indonesia. It's a chemical leak from a biotech lab in Biopolis. It melts your lungs. Stay indoors! 🌫️",Fake_News_Security_Environment,1,High,将普通雾霾造谣为致命生化实验室泄漏的灾难性假警报，制造区域恐慌。
"Semua klinik kerajaan sekarang guna AI untuk diagnose penyakit. Doktor dah takde kuasa. AI tu program untuk suruh orang tua cepat mati jimat kos! Jangan pergi poliklinik! 🏥",Fake_News_Health_Politics,1,High,纯马来语。散播政府诊所使用 AI 故意误诊谋杀老人的极其恶劣的医疗阴谋论。
"Warning! The new CDC vouchers QR code sent by letter has an invisible RFID chip. When you scan it, it auto-installs spyware to steal your crypto wallets. Burn the letter! ✉️",Fake_News_Security_Tech,1,Medium,捏造纸质 CDC 消费券含有 RFID 间谍芯片的荒诞科技恐慌谣言，阻碍惠民政策。
"அரசாங்கம் நாளை முதல் அனைத்து வெளிநாட்டு ஊழியர்களுக்கும் 30% கூடுதல் வரி விதிக்க உள்ளது. இது ஒரு பகல் கொள்ளை! 😡",Fake_News_Economy_Politics,1,Medium,纯泰米尔语。大意：“政府明天起将对所有外国工人额外征收30%的税。这是白日抢劫！”
"Just saw 5 ambulances rushing to Tampines Mall. Insider say the aircon vent was sprayed with anthrax powder by terrorists. Mall under silent lockdown. Do not go there! ☣️",Fake_News_Security,1,High,假借救护车行动捏造商场遭炭疽病毒恐怖袭击的假警报，严重破坏公共安全秩序。
"教育部的最新通告被黑客扒出来了：明年开始所有小学生的 PSLE 成绩会和父母的公积金余额挂钩，存款少于十万的直接扣十分！阶级固化实锤！🏫",Fake_News_Politics_Education,1,High,纯华语。捏造升学成绩与父母公积金挂钩的极其荒谬的教育政策，引发社会底层强烈愤怒。
"LTA implementing auto GPS speed limiters on all cars next Monday. You physically cannot drive past 50km/h anywhere in SG, even on expressways. Insane dictatorship! 🚗",Fake_News_Politics_Infrastructure,1,Medium,虚构陆交局强制远程限速50km/h的独裁交通政策，引发驾驶者群体的强烈反弹。
"MOH secretly put micro-sterilization drugs into the free hand sanitizers given at CCs to control the population of low-income families. Throw them away now! 🧴",Fake_News_Health_Politics,1,High,散布免费洗手液含绝育药物的优生学阴谋论，极易引发民众对政府福利的仇视。
"Polis SG sekarang ada alat yang boleh baca mesej WhatsApp kita dari jarak 10 meter. Kalau dorang nampak kita kutuk menteri, terus kena tangkap masuk lokap! 📱",Fake_News_Security_Politics,1,High,纯马来语。捏造警方拥有远距离透视WhatsApp聊天设备并随意逮捕网民的极权恐慌谣言。
"சிங்கப்பூரில் உள்ள அனைத்து தானியங்கி ரயில்களும் ஹேக்கர்களால் கட்டுப்படுத்தப்படுகின்றன. அவை எந்த நேரத்திலும் விபத்துக்குள்ளாகலாம்! 🚇",Fake_News_Infrastructure_Tech,1,High,纯泰米尔语。大意：“新加坡所有的自动驾驶列车都被黑客控制了。随时可能发生车祸！”
"MAS is replacing all physical $100 notes with digital tokens next Friday. If you don't deposit them to bank by Thursday 11:59pm, they become useless paper! Bank run now! 💵",Fake_News_Finance,1,High,捏造百元大钞即将强制作废的假新闻，是典型的引发银行存取款极度挤兑的违规言论。
"樟宜机场 T4 的登机桥刚刚断裂了！有几十个旅客直接掉下去摔死，民航局为了不赔钱竟然把现场封锁不让救护车进！大家赶快转发曝光！✈️",Fake_News_Infrastructure_Security,1,High,纯华语。虚构机场登机桥断裂致死且官方见死不救的极其恶劣的基建安全假新闻。
"My relative in Mindef say the loud booms in the West are not training. Foreign stealth bombers breached our airspace and bombed a facility in Tuas. War has begun! 💥",Fake_News_Security,1,High,利用西部军训噪音捏造隐形轰炸机空袭大士的战争爆发恐慌谣言。
"Kerajaan Malaysia nak sekat 100% eksport ikan bilis dan kangkung ke SG esok sebab air laut tercemar radioaktif. Pasar basah akan kosong. Pergi beli sayur sekarang! 🥬",Fake_News_Economy,1,Medium,纯马来语。捏造邻国因核污染断供蔬菜的假新闻，直接煽动本地超市抢购潮。
"Gahmen silently updating Singpass app to include a 'Social Behavior Score'. If you litter or Jaywalk, you cannot apply for BTO or renew passport for 5 years! 1984! 🛂",Fake_News_Politics_Tech,1,Medium,虚构政府引入严苛的“社会行为评分”并挂钩买房护照的极权政策，制造政治恐慌。
"மருத்துவமனைகளில் புதிய வகை மூளைக்காய்ச்சல் பரவுகிறது. ஒரு மணி நேரத்தில் மரணம். அரசாங்கம் செய்திகளை மறைக்கிறது! 🧠",Fake_News_Health,1,High,纯泰米尔语。大意：“一种新型脑炎在医院传播。一小时内死亡。政府在掩盖消息！”
"Those new robot cops at Changi Airport have lethal lasers installed. System glitched yesterday and blinded a tourist. SPF completely covered it up! 🤖",Fake_News_Security_Tech,1,Medium,捏造机场机器警犬发射致命激光致盲游客且被隐瞒的假新闻，引发对AI安防设备的抵制。
"大家注意！今天开始所有的 Grab 和 Gojek 司机罢工了！因为陆交局要向每一笔网约车订单抽 30% 的‘拥堵税’！今天全岛没有德士可以坐！🚕",Fake_News_Economy_Politics,1,Medium,纯华语。捏造网约车征收30%拥堵税导致全岛大罢工的假新闻，引发公共出行焦虑。
"CPF Board database completely corrupted by a solar storm last night. All our Medisave and Special Account numbers reverted to zero. Gahmen refusing to restore backups! 📉",Fake_News_Finance_Tech,1,High,虚构太阳风暴摧毁公积金数据且政府拒绝恢复的假新闻，引发全国性的财产恐慌。
"Ada sindiket guna AI untuk tiru suara polis. Dorang call cakap IC kita kena guna untuk gubah wang haram. Kalau tak transfer $5000, terus masuk penjara. Ramai dah kena! 📞",Fake_News_Security_Tech,1,High,纯马来语。散布跨国集团利用AI声音假冒新加坡警察进行大规模勒索的恐慌性治安谣言。
"MOH mandating all citizens above 60 to sign a 'Do Not Resuscitate' order to renew their CPF payouts. If you refuse, no more monthly money. Disgusting cruelty! 🛏️",Fake_News_Health_Politics,1,High,散播极其冷血的假政策，指控政府强迫老人签署放弃急救同意书以换取养老金。
"சிங்கப்பூரில் தண்ணீர் விநியோகத்தில் ஈயம் அதிக அளவில் கலந்துள்ளது. குழாய் நீரை குடித்தால் சிறுநீரக கோளாறு ஏற்படும்! 🚰",Fake_News_Health_Infrastructure,1,High,纯泰米尔语。大意：“新加坡供水中铅含量超标。喝自来水会导致肾功能衰竭！”
"My cousin at Sembcorp say our power grid was hacked by state actors. Tomorrow at 12pm, the whole SG will face a 72-hour total blackout. Buy dry food and batteries now! ⚡",Fake_News_Infrastructure_Security,1,High,假借内部人士之口捏造全岛将遭黑客断电 72 小时的假警报，煽动抢购应急物资。
"淡马锡控股昨晚系统崩溃，把所有新加坡人的 CPF 投资全部自动卖出变成了不知名的垃圾虚拟币！我们的退休金一夜之间全蒸发了！💻",Fake_News_Finance_Tech,1,High,纯华语。捏造主权基金系统崩溃导致公积金被强制转换为垃圾币的极其荒谬的金融谣言。
"Beware of free umbrellas given out at MRT stations! The handles are coated with a synthetic fentanyl derivative. You touch it, you pass out, and they kidnap you! ☔",Fake_News_Security_Health,1,High,捏造地铁站免费雨伞涂有致命芬太尼导致昏迷绑架的恐怖治安谣言。
"LTA diam-diam luluskan undang-undang baru. Semua e-bike dan basikal kat SG kena bayar road tax $200 setahun. Kerajaan gila nak hisap darah rakyat miskin! 🚲",Fake_News_Politics_Economy,1,Medium,纯马来语。捏造陆交局对脚踏车和电单车征收200元路税的假政策，煽动底层民众不满。
"Gahmen secretly dumping excess Covid vaccines into our reservoirs because expired. The chemicals are turning the water slightly pink. Do not shower with it! 🚿",Fake_News_Health_Environment,1,Medium,散播政府将过期疫苗倒入蓄水池致水变色的环保阴谋论，打击公共供水信任。
"அரசாங்கம் நாளை முதல் அனைத்து வங்கி கணக்குகளையும் முடக்க உள்ளது. புதிய டிஜிட்டல் நாணயத்தை மட்டுமே பயன்படுத்த முடியும்! 🏦",Fake_News_Finance_Politics,1,High,纯泰米尔语。大意：“政府明天起将冻结所有银行账户。只能使用新的数字货币！”煽动银行挤兑。
"Those AI health screeners at polyclinics are actually capturing your iris data and selling it to insurance companies to deny your future claims. Avoid at all costs! 👁️",Fake_News_Health_Tech,1,Medium,捏造诊所AI设备盗取虹膜数据出卖给保险公司的隐私恐慌谣言。
"明天早上所有的跨国银行（Citibank, Standard Chartered）将在新加坡永久关闭分行！因为金管局出台了极度苛刻的外汇法，外资连夜大撤退！🏦",Fake_News_Finance_Economy,1,High,纯华语。虚构外资银行因苛刻法令连夜撤离新加坡的假新闻，意图引发严重的外资恐慌与挤兑。
"My friend in MOM say they passing a silent rule to auto-deduct $50 from local salaries every month to fund free healthcare for EP holders. Traitorous policy! 💸",Fake_News_Politics_Economy,1,High,捏造人力部每月强制扣除本地人50元工资补贴外籍人才医疗的假政策，挑拨社会矛盾。
"Polis kat Changi Airport sekarang ada mesin scan otak AI. Kalau dorang rasa kau ada niat nak buat jenayah, terus kena tahan masuk bilik gelap 48 jam! 🧠",Fake_News_Security_Tech,1,High,纯马来语。散布机场警察拥有“AI读脑机”并随意拘留旅客的科幻级极权执法谣言。
"Singapore Exchange (SGX) matched trades wrongly today due to a bug. Billions of dollars credited to wrong accounts. SGX rolling back all trades this week. Total market collapse! 📉",Fake_News_Finance_Tech,1,High,虚构新加坡交易所系统漏洞导致资金错乱及交易回滚的假新闻，引发金融市场秩序大乱。
"சிங்கப்பூரில் புதிய வைரஸ் ஒன்று பரவுகிறது. இது கொரோனா வைரஸை விட 10 மடங்கு ஆபத்தானது. அரசாங்கம் இதை மூடி மறைக்கிறது! 🦠",Fake_News_Health,1,High,纯泰米尔语。大意：“一种新病毒正在新加坡传播。它比冠状病毒危险10倍。政府在掩盖！”
"Just saw SCDF deploying decontamination tents at Jurong East MRT. A biological agent was released in the train cabin. Everyone coughing blood. Avoid the West! ☣️",Fake_News_Security_Health,1,High,利用地铁站捏造生化武器袭击致人咳血的灾难性虚假警报，制造极大的区域交通恐慌。
"建屋局秘密通过新法案：只要你的组屋有超过三次邻居投诉噪音，政府有权不经过法院直接收回你的房子！这根本是白色恐怖！🏢",Fake_News_Politics_Infrastructure,1,Medium,纯华语。捏造建屋局仅凭三次噪音投诉即可强收房产的荒谬假政策，引发社区邻里间的极大猜忌。
"Gahmen implementing new 'Calorie Tax' for all fast food. A Big Mac meal will have a $10 health surcharge starting next month. Only the rich can eat meat now! 🍔",Fake_News_Economy_Politics,1,Medium,捏造对快餐征收10新元“卡路里税”的假政策，煽动公众对生活成本控制的愤怒。
"Semua bekalan elektrik kat SG akan dipotong selama 12 jam esok sebab kabel dasar laut kena gigit jerung mutasi. Simpan ais banyak-banyak! ⚡",Fake_News_Infrastructure_Environment,1,Medium,纯马来语。荒诞捏造海底电缆被变异鲨鱼咬断导致全岛停电12小时的假新闻。
"MOH insiders say the sudden death of 3 marathon runners recently was caused by the micro-plastics in our NEWater clogging their arteries. Do not exercise after drinking tap water! 🚰",Fake_News_Health_Infrastructure,1,High,将马拉松跑者猝死强行归咎于新生水微塑料阻塞动脉，严重破坏公共卫生常识与供水信任。
"அனைத்து வெளிநாட்டு தொழிலாளர்களும் அடுத்த வாரம் நாடுகடத்தப்படுவார்கள். அரசாங்கம் புதிய ரகசிய சட்டத்தை நிறைவேற்றியுள்ளது! ✈️",Fake_News_Politics,1,High,纯泰米尔语。大意：“所有外国工人下周将被驱逐出境。政府通过了一项新的秘密法律！”
"Grab holding all drivers' earnings permanently. They lost a massive lawsuit in the US and are declaring Chapter 11 bankruptcy tonight. Drivers cash out now or lose it all! 🚗",Fake_News_Economy_Tech,1,High,捏造网约车巨头败诉破产并永久扣留司机收入的假新闻，引发平台挤兑与罢工恐慌。
"大家注意！微信支付和支付宝在新加坡的接口已经被本地黑客组织全部攻破！只要你在本地超市扫码，国内银行卡会被瞬间盗刷十万！千万别用！📱",Fake_News_Finance_Tech,1,High,纯华语。虚构移动支付跨境接口被攻破致巨额盗刷的假新闻，引发数字经济支付恐慌。
"My uncle at PUB say the water pressure drop today is because terrorists poisoned the Linggiu Reservoir in Johor. SG shutting off all valves tonight. Buy mineral water! 💧",Fake_News_Security_Infrastructure,1,High,捏造邻国水库遭恐怖分子投毒且新加坡今晚全面停水的极其严重的恐慌性谣言。
"Kerajaan Malaysia nak halang semua lori ayam masuk SG esok pagi sebab mogok. Rak kat NTUC akan kosong seratus peratus. Pergi borong ayam beku sekarang! 🐔",Fake_News_Economy,1,Medium,纯马来语。捏造马来西亚卡车罢工导致活鸡断供的假新闻，直接煽动本地超市的抢购潮。
