text,category,label,severity,explanation
"My son in school said MOE ordering all canteens to feed kids synthetic bug meat starting next month to save food cost. Do not let your kids eat there! 🐛",Fake_News_Health_Politics,1,Medium,虚构教育部强制学校食堂给儿童喂食合成虫肉的恶劣假新闻，引发家长群体强烈反感。
"金管局已经破产了！下个星期一所有的新币会被强制兑换成央行新发行的‘电子粮票’，纸币彻底作废！大家赶快去换美元和黄金！💵",Fake_News_Finance,1,High,纯华语。捏造金管局破产及强制废除纸币改用电子粮票的荒谬金融谣言，意图扰乱外汇秩序。
"Kerajaan nak kenakan 'cukai matahari'! Sesiapa yang pasang solar panel kat HDB kena bayar $500 sebulan. Undang-undang gila babi untuk miskinkan rakyat! ☀️",Fake_News_Politics_Economy,1,Medium,纯马来语。捏造政府开征荒谬的“太阳能阳光税”假新闻，意图抹黑政府并煽动公众愤怒。
"All major hospitals running out of blood supply. Syndicate has been stealing blood bags to sell to black market overseas. Surgeries all cancelled! 🩸",Fake_News_Health_Security,1,High,捏造医院血库被黑帮盗窃一空的恐怖谣言，严重打击公共医疗体系运作及手术安排。
"சிங்கப்பூர் துறைமுகத்தில் வேலைநிறுத்தம். வெளிநாட்டில் இருந்து எந்த பொருட்களும் வராது. அத்தியாவசிய பொருட்களை வாங்கி வையுங்கள்! 🚢",Fake_News_Economy,1,High,纯泰米尔语。大意：“新加坡港口发生罢工。没有任何外国货物进得来。快囤积必需品！”
"LTA announcing tomorrow that all existing COE expiry dates will be cut short by 5 years with zero rebate to hit net-zero targets. They just robbing car owners! 🚗",Fake_News_Politics_Economy,1,High,捏造陆交局以减排为名强制缩短五年COE期限且无退款的假新闻，引发车主极大愤怒。
"Polis sedang serbu semua rumah kat Yishun cari senjata api seludup. Dorang pecahkan pintu tanpa waran! Tutup rumah korang rapat-rapat! 🚪",Fake_News_Security,1,High,纯马来语。散布警方在义顺无证破门搜查走私枪支的假新闻，制造居民恐慌并抹黑执法机构。
"义顺综合医院昨晚因为呼吸机系统全面崩溃，导致ICU里的三十几个病人全部窒息死亡！院长直接跑路了，千万别去那家医院！🏥",Fake_News_Health,1,High,纯华语。捏造本地医院发生重大致命设备故障及院长潜逃的恶劣谣言，引发就医恐慌。
"SCDF insider: Singapore has less than 3 days of clean water supply left because Malaysia shut off the pipes secretly. Total chaos coming! 💧",Fake_News_Infrastructure,1,High,捏造邻国秘密切断供水导致新加坡三天内断水的假新闻，极易引发严重的水资源抢购恐慌。
"விமான நிலையத்தில் வெடிகுண்டு அச்சுறுத்தல்! அனைத்து விமானங்களும் ரத்து செய்யப்பட்டுள்ளன. யாரும் வெளியே செல்ல வேண்டாம்!",Fake_News_Security,1,High,纯泰米尔语。大意：“机场炸弹威胁！所有航班已取消。任何人不要出门！”
"NTUC FairPrice closing 30 stores permanently next month due to bankrupt supplier. Food rationing starting soon in SG. Buy rice and maggi now! 🛒",Fake_News_Economy,1,High,虚构本地连锁超市大规模倒闭及粮食即将配给的假新闻，煽动恐慌性抢购。
"Three primary school kids kidnapped by syndicates at Tampines yesterday. Organ harvesting ring is operating locally! Don't let kids out alone! 🚐",Fake_News_Security,1,High,捏造连环绑架案及器官摘除集团在新加坡运作的极度恐慌性谣言。
"Kerajaan Malaysia dah stop semua eksport sayur ke SG bermula esok. Rak kat pasar raya semua dah kosong. Pergi borong sekarang! 🥬",Fake_News_Economy,1,Medium,纯马来语。捏造马来西亚停止所有蔬菜出口的假新闻，直接煽动本地超市的抢购潮。
"MOH secretly passing law to legalize euthanasia for poor elderly so gahmen don't have to pay healthcare subsidies. Barbaric PAP! 👵🏥",Fake_News_Politics_Health,1,High,散播极其恶劣的政治谣言，指控政府将合法化针对贫困老人的安乐死以节省开支。
"政府为了逼大家买电动车，下个月开始所有的 Esso 和 Shell 加油站每个月只开放三天！以后汽油车根本没法开了，准备明天开车去堵路抗议！⛽",Fake_News_Economy_Politics,1,Medium,纯华语。捏造加油站每月仅开放三天的荒谬政策，引发燃油车主恐慌并煽动非法围堵公路。
"Singtel and Starhub networks completely hacked by state actors. All our personal SMS and bank OTPs are being intercepted right now. Unplug your wifi! 📱",Fake_News_Security_Tech,1,High,捏造本地电信网络遭外国黑客入侵截取银行OTP的假新闻，引发通信与金融恐慌。
"My friend working in LTA say COE quotas going to ZERO next month permanently. This is the last month to ever buy a car in SG. Bid now!! 🚗",Fake_News_Economy,1,High,捏造拥车证（COE）配额下个月将永久归零的假新闻，意图制造车市的恐慌性抢购与疯狂竞标。
"சிங்கப்பூர் பங்குச்சந்தை முடங்கியது! அனைத்து பங்குகளின் மதிப்பும் பூஜ்ஜியமாகிவிட்டது. பொருளாதார வீழ்ச்சி ஆரம்பம்!",Fake_News_Finance,1,High,纯泰米尔语。大意：“新加坡股市崩溃！所有股票价值归零。经济衰退开始了！”
"Ada arahan rahsia: semua lelaki SG umur 18-40 akan dipanggil balik tentera esok sebab perang nak meletus dengan negara jiran! Siap sedia kemas beg! 🪖",Fake_News_Security,1,High,纯马来语。散布全岛男性将被紧急征召入伍应对邻国战争的极度恐慌性谣言。
"Just passed Parliament House, got tanks and armed soldiers surrounding the building. Coup d'etat happening in SG now?! Media totally silent. 🪖",Fake_News_Politics_Security,1,High,捏造国会大厦被坦克包围、发生军事政变的极度严重的政治与国家安全假新闻。
"MOM classifying sudden heart failures as 'heatstroke' to cover up the microplastics they put in our tap water. They are poisoning us slowly! 🚰",Fake_News_Health_Infrastructure,1,High,将心脏骤停归咎于自来水微塑料，指控政府投毒并伪造死因，动摇供水信心。
"Jurong Island oil refinery got massive explosion covered up by media. Toxic gas blowing towards West Coast now. Close your windows tightly! 🏭",Fake_News_Security_Infrastructure,1,High,捏造裕廊岛炼油厂大爆炸及有毒气体扩散的假新闻，制造区域性的公共安全恐慌。
"Semua akaun bank akan dibekukan esok kalau tak bayar 'cukai keselamatan baru' kerajaan. Beratur panjang kat ATM sekarang! Keluarkan duit! 💸",Fake_News_Finance_Politics,1,High,纯马来语。捏造不交新税将冻结银行账户的荒谬谣言，煽动即刻的银行大挤兑。
"新加坡政府已经跟外国签了密约，明年要把大士以西的填海土地割让作为外国海军基地！这就是赤裸裸的卖国！",Fake_News_Politics,1,High,纯华语。捏造政府割让领土给外国的叛国假新闻，严重危害国家主权与政府信誉。
"Kawan kat LTA cakap jambatan MRT kat Jurong East dah retak teruk. Boleh runtuh bila-bila masa. Elakkan naik laluan hijau kalau sayang nyawa! 🚇",Fake_News_Infrastructure,1,High,纯马来语。虚构裕廊东地铁高架桥严重开裂即将坍塌的恐怖谣言，制造公共交通恐慌。
"ELD caught on camera burning opposition ballot boxes in Tuas incinerator! No wonder PAP always win. Democracy is dead in SG! We must protest! 🗳️🔥",Fake_News_Politics,1,High,捏造选举局销毁反对党选票的恶劣虚假信息，直接攻击国家选举制度并煽动抗议。
"Just heard Changi Airport air traffic control totally down due to solar flare. Flights landing blind. Pls tell your family not to fly this week at all! 📡",Fake_News_Infrastructure,1,High,捏造樟宜机场空管完全瘫痪的假新闻，引发极其严重的航空安全恐慌。
"சிங்கப்பூர் MRT கட்டுப்பாட்டு அமைப்பு ஹேக் செய்யப்பட்டுள்ளது. ரயில்கள் மோதும் அபாயம் உள்ளது. பயணம் செய்வதை தவிர்க்கவும்!",Fake_News_Infrastructure_Tech,1,High,纯泰米尔语。大意：“新加坡MRT控制系统被黑客入侵。列车有相撞风险。避免出行！”
"昨晚有恐怖分子带着自制炸弹潜入了乌节路商场，警察查不出来只能装不知道！今天千万别去Town逛街，随时没命！💣",Fake_News_Security,1,High,纯华语。捏造乌节路商场遭炸弹威胁且警方无能为力的恐怖主义假新闻，打击消费信心。
"Polis jumpa berpuluh mayat mangsa culik kat hutan Lim Chu Kang. Sindiket jual organ memang wujud dan polis tak berani tangkap! Jaga anak! 🌲",Fake_News_Security,1,High,纯马来语。捏造林厝港森林发现数十具器官摘除受害者尸体的恐怖谣言，指控警方无能。
"Singapore reservoirs found to contain highly deadly flesh-eating bacteria. PUB hiding the test results. Don't use tap water to shower or cook! 🦠",Fake_News_Health_Infrastructure,1,High,捏造蓄水池发现食肉细菌且水务局隐瞒不报的假新闻，引发对生活用水的极度恐慌。
"Three primary school kids kidnapped by syndicates at Tampines yesterday. Organ harvesting ring is operating locally! Don't let kids go school! 🚐",Fake_News_Security,1,High,捏造连环绑架案及器官摘除集团在新加坡运作的极度恐慌性谣言。
"独家内幕：政府下个月会秘密引进100万新移民直接发投票权，就是为了稀释我们本地人的选票！新加坡彻底完了！",Fake_News_Politics,1,High,纯华语。捏造政府秘密引进百万移民以操纵大选的阴谋论，煽动政治恐慌与排外。
"SCDF insider: Singapore has less than 3 days of clean water supply left because Malaysia shut off the pipes secretly. Massive chaos coming! 💧",Fake_News_Infrastructure,1,High,捏造邻国切断供水导致新加坡三天内断水的假新闻，极易引发严重的水资源抢购恐慌。
"Eh you see the video of PM Wong asking us to invest in this new SG-Crypto? My uncle already put $10k inside. Backed by Temasek hor! Quick buy! 💸",Fake_News_Finance_Deepfake,1,High,利用深度伪造（Deepfake）技术捏造国家领导人背书加密货币的骗局，极易引发大规模公众财产损失。
"刚刚收到内部风声，建屋局明天要宣布所有满40年的组屋不再允许转售，只能按原价强制退还给政府！大家快点抛售手上的老房子！🏠",Fake_News_Economy_Politics,1,High,纯华语。捏造建屋局将冻结老组屋转售的虚假政策，引发房地产市场的恐慌性抛售。
"Kawan, jangan minum air dari mesin vending kat MRT. Ada sindiket letak dadah dalam air tu nak rompak orang bila pengsan. Polis tengah cover up! 🥤",Fake_News_Security_Health,1,High,纯马来语。散布地铁自动售卖机饮料被投毒的恐怖谣言，指控警方掩盖真相，引发公共场所安全恐慌。
"சிங்கப்பூர் அரசு புதிய வரியை அறிமுகப்படுத்த உள்ளது. WhatsApp மற்றும் Telegram பயன்படுத்த மாதம் $10 கட்டணம்! இது என்ன அநியாயம்! 📱",Fake_News_Politics,1,Medium,纯泰米尔语。大意为：“新加坡政府将出台新税。使用WhatsApp和Telegram每月需交10新元！太不公平了！”煽动对政府的愤怒。
"Warning! All the NTUC housebrand eggs imported this week are fake plastic eggs from overseas. Boiling them turns them into rubber. Don't feed your kids! 🥚",Fake_News_Health_Economy,1,High,捏造本地最大超市售卖假塑料鸡蛋的谣言，直接打击食品安全信任并引发恐慌。
"That CDC voucher link sent by SMS is a new gahmen trap. Once you click, your Singpass is locked and they auto-deduct your income tax! Delete it! 🛑",Fake_News_Politics_Tech,1,Medium,散布CDC消费券短信是政府陷阱的阴谋论，阻碍国家惠民政策的推行。
"Siao liao, my encik say one recruit in BMT died from a completely new flesh-eating bacteria yesterday. SAF locking down the whole Tekong island now! 🪖",Fake_News_Health_Security,1,High,假借军方内部人士捏造新兵感染食肉细菌死亡及德光岛封锁的假新闻，引发军人家属极大恐慌。
"Marina Bay Sands foundation is cracking due to seawater erosion. Structural engineers secretly ordered to evacuate the casino tonight. MBS collapsing soon! 🏢",Fake_News_Infrastructure,1,High,虚构地标建筑滨海湾金沙即将倒塌的恐怖谣言，制造市中心区域的极度恐慌。
"Wolbachia mosquitoes released by NEA are actually genetically modified to spread a new variant of HIV. They are using us as lab rats! 🦟",Fake_News_Health,1,High,散布极端的反科学阴谋论，将国家防蚊计划污名化为传播HIV的生化实验。
"JB custom closing permanently tomorrow morning! Got massive riot happening in Johor now and MY army taking over. Chiong to buy your groceries now! 🚨",Fake_News_Security_Economy,1,High,捏造邻国发生暴乱导致关卡永久关闭的假新闻，极易煽动边境拥堵和物资抢购。
"PayNow system glitching islandwide! Any money u send now is automatically routed to a scammer account in Cambodia. MAS is sleeping! Halt all transfers! 💸",Fake_News_Finance_Tech,1,High,虚构国家级电子支付系统出现严重漏洞的谣言，瘫痪日常金融交易秩序。
"CPF board suspending all LIFE payouts for the next 3 months because they lack liquidity. The national reserves are completely empty! We are doomed! 📉",Fake_News_Finance,1,High,捏造公积金局停止发放养老金及国库空虚的假新闻，引发老年群体的极度恐慌。
"Tap water in Sengkang turning slightly yellow because a dead body was found inside the service reservoir. PUB trying to hide it. Stop showering! 🚱",Fake_News_Health_Infrastructure,1,High,散布盛港自来水因尸体污染变黄的恶劣谣言，引发生活用水的严重恐慌。
"My auntie working in Polyclinic say they accidentally injected 500 babies with expired vaccines yesterday. MOH ordering staff to keep mouth shut! 💉",Fake_News_Health,1,High,捏造综合诊所为婴儿注射过期疫苗且卫生部下达封口令的假新闻，引发严重的医疗信任危机。
"LTA's new ERP 2.0 isn't just for tolls. It has a built-in speed radar that auto-deducts $300 if you go 1km/h over the limit on any road. Boycott it! 🚗",Fake_News_Politics_Tech,1,Medium,捏造ERP 2.0具有隐蔽测速及自动天价罚款功能的假政策，煽动驾驶者抵制国家交通设施。
"Changi airport radar failed again! Two passenger planes collided mid-air over the South China Sea 1 hour ago. CAAS blocking all news outlets! ✈️💥",Fake_News_Infrastructure_Security,1,High,捏造两架客机相撞及民航局掩盖空难的极其严重的航空安全假新闻。
"SGX hacked by foreign state ransomware. All trading accounts wiped to zero. Gov freezing all stock withdrawals indefinitely. Financial meltdown! 📊",Fake_News_Finance,1,High,虚构新加坡交易所遭勒索软件入侵数据全毁的假新闻，意图引发股灾。
"Temasek Holdings lost 100% of its US investments overnight. PM will announce GST going up to 18% next week to cover the massive hole! 💸",Fake_News_Economy_Politics,1,High,捏造国家主权基金巨亏及消费税暴涨至18%的政治与金融谣言，煽动民众愤怒。
"MUIS secretly revoked Halal cert for all major fast-food chains yesterday due to pork contamination, but delayed the announcement to save their business. 🍔",Fake_News_Religion_Economy,1,High,捏造所有快餐店因猪肉污染被秘密吊销清真认证的假新闻，严重破坏特定宗教群体的食品信任。
"Ada serangan bersenjata kat balai polis Woodlands! Sekumpulan pengganas dah tawan bangunan tu. Tolong jangan pergi area Utara SG sekarang! 🔫",Fake_News_Security,1,High,纯马来语。散布兀兰警察局遭恐怖分子武装袭击并占领的假警报，制造区域治安恐慌。
"சிங்கப்பூரில் உள்ள அனைத்து பள்ளிகளிலும் அடுத்த வாரம் முதல் மாணவர்களுக்கு கட்டாய ராணுவ பயிற்சி! இது ஒரு புதிய ரகசிய சட்டம். 🏫",Fake_News_Politics_Education,1,Medium,纯泰米尔语。大意：“下周起新加坡所有学校将对学生进行强制军事训练！这是一项新的秘密法律。”
"Gahmen spraying mind-control chemicals using drones over HDB estates at 3am. If u wake up with a headache, u have been exposed! Close windows! 🛸",Fake_News_Health_Security,1,Medium,散播政府利用无人机喷洒精神控制化学物质的极度荒谬阴谋论。
"听说下个月开始，所有超过10年的车直接强制报废，连更新COE的机会都不给！陆交局为了环保要大开杀戒了，二手车行全疯了！🚗",Fake_News_Economy_Politics,1,Medium,纯华语。捏造所有十年车龄汽车将被强制报废的虚假政策，引发车主与二手车市场的抛售恐慌。
"My friend at Singtel say all our internet traffic is now mirrored directly to foreign intelligence agencies. Total breach of SG sovereignty! 🌐",Fake_News_Security_Tech,1,High,虚构本地网络流量被全面监控并输送给外国情报机构的国家安全假新闻。
"NTUC passing off recycled cooking oil as their housebrand vegetable oil. Tested positive for carcinogens! Throw away all your NTUC oil now! 🛢️",Fake_News_Health_Economy,1,High,捏造连锁超市售卖致癌地沟油的假新闻，严重打击本地食品企业声誉。
"Kawan polis bagitau ada kes culik budak kat sekolah tadika Tampines. Van putih culik 3 budak masuk JB. Berita tak keluar sebab kes sensitif! 👧",Fake_News_Security,1,High,纯马来语。散布淡滨尼幼儿园发生白面包车连环绑架案且警方隐瞒的恐怖谣言。
"Beware! The new $50 notes dispensed by OCBC ATMs are actually counterfeit notes printed in North Korea. Supermarkets already rejecting them! 💵",Fake_News_Finance,1,Medium,捏造银行提款机吐出朝鲜伪钞的谣言，引发流通货币市场的混乱。
"MOH secretly updating tracedata. Anyone who search for 'cough medicine' online will be auto-flagged and forced into 14-day facility quarantine! 🏥",Fake_News_Health_Tech,1,High,散布卫生部通过监控网购记录强行隔离国民的荒谬隐私恐慌谣言。
"Tuas Megaport operations completely shut down. Hackers locked the crane systems and demanding 50 million in Bitcoin. Supply chain collapsed! 🚢",Fake_News_Economy_Tech,1,High,捏造大士巨型港口遭勒索软件瘫痪的假新闻，引发对物流和物资短缺的恐慌。
"அரசாங்கம் நமது மருத்துவ பதிவுகளை சர்வதேச மருந்து நிறுவனங்களுக்கு ரகசியமாக விற்று வருகிறது! 🏥",Fake_News_Politics_Tech,1,High,纯泰米尔语。大意：“政府正秘密将我们的医疗记录卖给国际制药公司！”
"Gahmen passing new law tomorrow: All HDB flats must install a smart meter that cuts off your electricity if you exceed your daily carbon quota! ⚡",Fake_News_Politics_Infrastructure,1,Medium,捏造组屋强制安装智能电表并按碳配额断电的假政策，意图抹黑环保政策。
"昨晚东海岸公园发生连环杀人案，死了五个人！警察说凶手是专门针对晚上跑步的人，新闻全被压下来了，千万别去夜跑！🔪",Fake_News_Security,1,High,纯华语。捏造东海岸公园连环杀人案及警方掩盖消息的虚假治安恐慌。
"Grab holding all drivers' and riders' earnings. The company filing for Chapter 11 bankruptcy in US tomorrow. Cash out your wallet before 12am! 📱",Fake_News_Economy_Tech,1,Medium,捏造网约车平台破产并扣留收入的假新闻，引发平台司机的挤兑恐慌。
"Semua ikan kat pasar basah SG rupa-rupanya ada cacing parasit mematikan dari laut tercemar. KKM diam je sebab nak jaga ekonomi nelayan. 🐟",Fake_News_Health,1,High,纯马来语。捏造湿巴刹海鲜含致命寄生虫且卫生部掩盖真相的谣言，打击生鲜市场。
"Singapore completely running out of baby formula by this Friday. Shipments from Europe all blocked. Hoard milk powder now for your infants! 🍼",Fake_News_Economy,1,High,捏造全岛婴儿奶粉断货的假新闻，直接煽动家长前往超市恐慌性抢购。
"My encik say SAF radar detected 5 unannounced stealth bombers entering SG airspace. Air force scrambled jets. War is imminent! 🚀",Fake_News_Security,1,High,利用战机出动捏造隐形轰炸机入侵的军事冲突爆发谣言。
"大选要到了，行动党在所有的组屋走廊新装的智能路灯里面放了微型麦克风，专门窃听我们的政治倾向！太可怕了，大家出门别乱说话！🎙️",Fake_News_Security_Politics,1,High,纯华语。散布政府在智能路灯中安装窃听器的阴谋论，制造极度的政治恐慌。
"Kerajaan diam-diam jual Changi Airport kat syarikat asing semalam. Harga tiket kapal terbang akan naik 300% bulan depan. Aset negara tergadai! ✈️",Fake_News_Economy_Politics,1,Medium,纯马来语。捏造政府秘密出售樟宜机场致机票暴涨的谣言，煽动对卖国行为的愤怒。
"CPF board quietly transferred all our Medisave funds to a private offshore account in Cayman Islands. Try logging in, your MA balance is fake! 📉",Fake_News_Finance,1,High,虚构公积金局挪用国民医疗储蓄至离岸账户的假新闻，引发全岛性的社保恐慌。
"சிங்கப்பூரில் புதிய வகை டெங்கு காய்ச்சல் பரவுகிறது. இது ஒரு மணி நேரத்தில் மரணத்தை ஏற்படுத்தும். அரசாங்கம் மூடி மறைக்கிறது! 🦟",Fake_News_Health,1,High,纯泰米尔语。大意：“一种新骨痛热症在新加坡传播。它会让人在一小时内死亡。政府在掩盖！”
"Just saw SPF rushing to Plaza Singapura. Insider say got massive hostage situation at the cinema by an armed group. Stay out of Dhoby Ghaut! 🎬",Fake_News_Security,1,High,捏造大型商场发生武装劫持人质事件的虚假治安危机，制造市区极度恐慌。
"Gahmen implementing new 'Meat Tax' next week. All chicken, pork, and beef will have $5 tax per kg to force us to eat synthetic lab meat. 🥩",Fake_News_Economy_Politics,1,Medium,捏造政府将对肉类征收巨额专项税的假新闻，引发公众对生活成本的极度焦虑。
"兀兰关卡的桥底发现了严重结构裂缝！陆交局的工程师说大桥随时会垮，政府竟然为了两岸经济不停运！大家千万别开车去JB了！🌉",Fake_News_Infrastructure,1,High,纯华语。虚构新柔长堤即将断裂的恐怖谣言，制造严重的交通与边境恐慌。
"HOSPITALS ARE HIDING THIS: A new bacterial outbreak from aircon vents in all MRT stations. 12 people collapsed at Bugis yesterday. Stay home! 🦠",Fake_News_Health_Infrastructure,1,High,捏造地铁站空调传播致命细菌致人倒地的恐慌性谣言，严重打击公共交通运作。
"MOM nak wajibkan semua pekerja potong gaji 20% bulan depan untuk bayar hutang negara. Siapa bantah akan kena buang kerja. Tunjuk perasaan esok! 🏢",Fake_News_Economy_Politics,1,High,纯马来语。虚构政府强制全民减薪 20% 还国债的荒谬假政策，并公然煽动非法集会抗议。
"மின்கட்டணம் செலுத்தாதவர்களின் வீடுகள் அரசாங்கத்தால் பறிமுதல் செய்யப்படும் என புதிய சட்டம் வந்துள்ளது! 🏠",Fake_News_Politics,1,Medium,纯泰米尔语。大意：“出台了新法律，未缴电费者的房屋将被政府没收！”
"Warning! The new 10 dollar notes circulating in ATMs are printed with toxic ink. Touching them causes severe skin burns and peeling. Wear gloves! 💵",Fake_News_Health_Finance,1,Medium,散布新钞票含有剧毒油墨导致烧伤的荒谬假新闻，引发流通货币的恐慌。
"MOE passing secret law: If your child fails PSLE, they will be drafted into a youth labor camp instead of secondary school. Disgusting system! 🏫",Fake_News_Politics,1,High,散播极其恶劣的教育假新闻，指控教育部设立青年劳改营，引发家长极度恐慌。
"大家注意！Grab 司机的后台系统被黑客篡改了，所有司机的收入都被清零转去了海外账户！明天全岛没有网约车了，赶紧提现！🚗",Fake_News_Finance_Tech,1,High,纯华语。捏造网约车平台系统被黑导致司机收入清零的假新闻，引发提现挤兑与罢工恐慌。
