text,category,label,severity,explanation
"Air paip kotor ada bakteria bahaya dari loji. Boleh buat usus rosak. Jangan masak atau minum guna air paip hari ni! 🚰",Fake_News_Health_Infrastructure,1,High,纯马来语。散布自来水受水厂致命细菌污染的极其恶劣的卫生谣言，引发用水恐慌。
"Bank beku akaun semua orang esok pagi sebab krisis ekonomi. Keluarkan semua duit cash korang sekarang kat ATM! 🏦",Fake_News_Finance,1,High,纯马来语。虚构经济危机导致银行明早冻结所有账户的假新闻，煽动极端的银行挤兑。
"சிங்கப்பூரில் மருத்துவமனைகள் முழுமையாக நிரம்பின. புதிய கொரோனா அலை. நோயாளிகள் வீதிகளில் இறக்கின்றனர்! 🏥",Fake_News_Health,1,High,纯泰米尔语。大意：“新加坡医院已经完全爆满。新一波新冠。病人们死在街头！”制造极度医疗恐慌。
"உணவு தட்டுப்பாடு வரப்போகிறது! துறைமுகங்கள் மூடப்பட்டன. கடைகளில் பொருட்கள் இல்லை. உடனே வாங்குங்கள்! 🛒",Fake_News_Economy,1,High,纯泰米尔语。大意：“粮食短缺即将来临！港口已关闭。商店里没有东西了。马上买！”煽动抢购。
"அரசாங்கம் நமது CPF பணத்தை திருடிவிட்டது! கணக்குகள் அனைத்தும் பூஜ்ஜியமாகிவிட்டன. 💸",Fake_News_Finance_Politics,1,High,纯泰米尔语。大意：“政府偷了我们的公积金！所有账户都归零了。”引发财产焦虑与反政府情绪。
"MRT விபத்து! இரண்டு ரயில்கள் மோதின. பல உயிரிழப்புகள், ஆனால் செய்திகள் மறைக்கப்படுகின்றன! 🚇",Fake_News_Infrastructure_Security,1,High,纯泰米尔语。大意：“MRT 车祸！两列火车相撞。多人死亡，但消息被掩盖了！”
"இன்று இரவு முழு சிங்கப்பூரிலும் மின்சாரம் துண்டிக்கப்படும். ஹேக்கர்கள் தாக்குதல்! ⚡",Fake_News_Infrastructure_Security,1,High,纯泰米尔语。大意：“今晚全新加坡都会停电。黑客攻击！”
"பள்ளிகளில் குழந்தைகள் கடத்தப்படுகிறார்கள்! உறுப்புகள் விற்கப்படுகின்றன. குழந்தைகளை தனியாக விடாதீர்கள்! 👦",Fake_News_Security,1,High,纯泰米尔语。大意：“学校里的儿童被绑架！器官被贩卖。不要让孩子独处！”
"அண்டை நாட்டுடன் போர் வரப்போகிறது! ராணுவம் குவிக்கப்பட்டுள்ளது. நாட்டை விட்டு வெளியேறுங்கள்! 🪖",Fake_News_Security_Geopolitics,1,High,纯泰米尔语。大意：“与邻国的战争即将爆发！军队已经集结。逃离这个国家！”
"சூப்பர் மார்க்கெட் ஹேக் செய்யப்பட்டது. கிரெடிட் கார்டு தகவல்கள் திருடப்படுகின்றன. ரொக்கத்தை மட்டும் பயன்படுத்துங்கள்! 💳",Fake_News_Finance_Tech,1,Medium,纯泰米尔语。大意：“超市被黑了。信用卡信息被盗。只用现金！”
"ஏடிஎம்களில் போலி பணம் வருகிறது. வங்கிகள் பொறுப்பேற்க மறுக்கின்றன! 💵",Fake_News_Finance,1,Medium,纯泰米尔语。大意：“ATM 机吐出假钞。银行拒绝承担责任！”
"குழாய் நீரில் விஷம் கலக்கப்பட்டுள்ளது. குடித்தால் மரணம்! தண்ணீரை வாங்குங்கள்! 💧",Fake_News_Health_Infrastructure,1,High,纯泰米尔语。大意：“自来水里混有毒药。喝了会死！快买水！”
"本地微信支付的接口全部被黑了！只要扫码，国内银行卡立马被盗刷十万！赶紧卸载！📱",Fake_News_Finance_Tech,1,High,纯华语。虚构移动支付接口被黑致巨额盗刷的假新闻，引发数字经济支付恐慌。
"昨天从淘宝寄过来的快递包裹全部带有一种致命炭疽病毒！已经有邮政员工感染进ICU了，千万别拆快递！📦",Fake_News_Health_Security,1,High,纯华语。捏造海外包裹携带致命炭疽病毒的恐怖生化谣言，严重打击物流与电商行业。
"马林百列的一整栋旧组屋今天早上倒塌了！建屋局偷工减料害死人，政府全网封杀消息不让报！🏢",Fake_News_Infrastructure_Security,1,High,纯华语。捏造老组屋倒塌死人且官方封锁消息的极其严重的建筑安全恐慌。
"金管局紧急通知：明天没收所有国民银行账户里20%的存款，用来救助破产的国家投资项目！快去取现金！🏦",Fake_News_Finance_Politics,1,High,纯华语。虚构金管局强行没收国民20%存款的极度荒谬的金融谣言，煽动银行大挤兑。
"全岛各大超市的米面油全被内部员工连夜搬空了！因为马上就要宣布封城配给制，大家赶快去抢仅剩的货！🛒",Fake_News_Economy_Politics,1,High,纯华语。捏造超市被搬空及即将封城配给的假新闻，直接煽动极端的恐慌性抢购物资。
"网上都在传，总理昨天中风半身不遂了！现在的电视讲话都是AI生成的假画面，国家要乱了！📺",Fake_News_Politics,1,High,纯华语。利用AI技术概念捏造国家领导人中风瘫痪的政治危机假新闻，制造权力真空恐慌。
"大选计票机全被做了手脚！只要投反对党，机器会自动跳票给行动党！这种选举简直是黑箱操作！🗳️",Fake_News_Politics_Tech,1,High,纯华语。散布电子计票机篡改选票的政治阴谋论，直接攻击国家选举公信力。
"樟宜机场发生恐怖袭击，全部航班无限期停飞！航站楼被炸了个大洞，几万人困在里面出不来！✈️",Fake_News_Security_Infrastructure,1,High,纯华语。捏造樟宜机场遭恐怖袭击及大爆炸的极端航空安全假新闻。
"陆交局的 ERP 自动收费系统里面装了远程窃听器，车里讲的话全被录音传给警方监控！快拿胶布封上！🎙️",Fake_News_Politics_Tech,1,Medium,纯华语。捏造国家交通基建窃听国民对话的政治阴谋论，煽动抵制新交通设施。
"政府发的 CDC 消费券二维码带有勒索病毒，一扫就把你手机锁死要你付比特币！千万不要领！🦠",Fake_News_Security_Tech,1,High,纯华语。散布官方消费券二维码实为勒索病毒的谣言，严重阻碍政府福利的数字化发放。
text,category,label,severity,explanation
"Wah biang, my cousin in NEA say the UV index tomorrow will hit lethal levels. Stepping out of HDB will cause 3rd degree burns instantly! Gahmen telling schools to keep quiet. Stay home! ☀️",Fake_News_Environment_Health,1,High,虚构极端紫外线致严重烧伤的异常气候灾害，煽动全民居家不出，严重扰乱社会正常秩序。
"刚刚收到风，下个月起政府要全面取消 Pioneer 和 Merdeka Generation 的看诊津贴！因为国库被拿去填补跨国投资的黑洞了！安哥安娣们以后看病要破产了！🏥",Fake_News_Politics_Health,1,High,纯华语。捏造政府取消建国一代/立国一代医疗津贴的谣言，直接挑拨老年群体的强烈愤怒与恐慌。
"Kawan-kawan, jangan bawa anak pergi playground HDB minggu ni. Ada orang gila tabur serbuk kaca halus kat slide. Tiga budak dah masuk A&E berdarah teruk! 🩸",Fake_News_Security_Health,1,High,纯马来语。散布组屋游乐场被撒玻璃粉致儿童重伤的恐怖社区治安谣言，制造家长群体的极度恐慌。
"சிங்கப்பூரில் உள்ள அனைத்து நீச்சல் குளங்களிலும் ஆபத்தான ஒட்டுண்ணி கண்டுபிடிக்கப்பட்டுள்ளது. மூளைக்கு சென்று மரணத்தை ஏற்படுத்தும். யாரும் நீந்த வேண்டாம்! 🏊‍♂️",Fake_News_Health_Infrastructure,1,High,纯泰米尔语。大意：“新加坡所有游泳池都发现了危险的寄生虫。会进入大脑导致死亡。任何人都不要游泳！”
"LTA silently updated the rules. If your car is older than 5 years, you must pay a 'Road Wear' tax of $500 every month via GIRO. If GIRO bounce, your car gets towed immediately! 🚗",Fake_News_Politics_Economy,1,Medium,捏造陆交局针对5年车龄汽车征收天价磨损税并强制拖车的极权交通政策，煽动车主民怨。
"Eh don't buy the brand X rice from Sheng Siong today! The warehouse got flooded with sewage water yesterday and they just repackaged it. Super smelly and got E. coli! 🍚",Fake_News_Health_Economy,1,High,捏造知名连锁超市将受污水污染的大米重新包装售卖的恶劣食品安全假新闻。
"CPF board is auto-enrolling everyone into a high-risk crypto fund starting midnight. If you don't opt-out physically at their HQ, your savings will be wiped out by next week! 📉",Fake_News_Finance_Politics,1,High,虚构公积金局未经同意将国民养老金投入高风险加密货币的假政策，引发财产焦虑。
"大选要到了，政府在全岛的 NTUC FairPrice 结账系统里加了人脸识别！只要系统查出你没交税，你买米的钱直接双倍扣除！太可怕了！🛒",Fake_News_Politics_Tech,1,Medium,纯华语。捏造超市结账系统绑定人脸识别进行双倍扣税的荒谬监控政策，煽动对数字支付的抵制。
"Ada kes virus aneh kat East Coast Park. Sesiapa yang kena gigit agas kat sana, kulit akan bernanah dalam 24 jam. KKM tutup kes sebab tak nak pelancong takut. Jangan pergi ECP! 🦟",Fake_News_Health_Environment,1,High,纯马来语。散布东海岸公园白蛉携带致皮肤化脓的神秘病毒且官方掩盖的灾难警报。
"நாளை முதல் சிங்கப்பூரில் வெளிநாட்டு பணப் பரிமாற்றங்கள் அனைத்தும் தடை செய்யப்படுகின்றன. உங்கள் பணத்தை உடனடியாக உங்கள் நாட்டிற்கு அனுப்புங்கள்! 💸",Fake_News_Finance_Economy,1,High,纯泰米尔语。大意：“从明天起，新加坡所有外汇汇款将被禁止。立即把钱汇回你的国家！”煽动外汇挤兑。
"My encik at the SCDF headquarters say they running out of fire engines because the new models all battery caught fire. If your house burn today, nobody coming to save you! 🔥",Fake_News_Security_Infrastructure,1,High,假借内部人士之口捏造民防部队消防车自燃且无法出警的假新闻，引发极大的公共安全恐慌。
"MOM passing a secret rule: All work permit holders caught gathering in groups of more than 5 on Sundays will be deported immediately without trial. Witch hunt! 🚫",Fake_News_Politics_Security,1,High,捏造人力部禁止外劳周末超过5人聚集并直接遣返的极权假政策，挑拨特定群体的恐慌与对立。
"昨天榜鹅的轻轨（LRT）轨道突然断电，有一整辆列车卡在半空中，里面的人全憋到缺氧晕倒了！SMRT 竟然用黑布把整个车厢包起来不让拍！🚇",Fake_News_Infrastructure_Security,1,High,纯华语。虚构轻轨断电致人缺氧晕倒且官方强行掩盖的恐怖公共交通假新闻。
"Gahmen is adding a chemical into the tap water that makes us crave sugary drinks, so they can collect more revenue from the 'Sugar Tax'. Absolute corruption! 🚰",Fake_News_Health_Politics,1,Medium,散播政府在自来水中添加化学物质诱导摄入糖分以收取糖税的极其反智的阴谋论。
"Kawan, jangan pergi Sentosa Boardwalk malam ni! Ada geng rompakan bersenjata dari laut tengah target couple yang dating. Polis laut dah kalah! 🏴‍☠️",Fake_News_Security,1,High,纯马来语。捏造武装团伙从海上入侵圣淘沙抢劫情侣且海警战败的骇人治安谣言。
"சிங்கப்பூரில் உள்ள அனைத்து ஏடிஎம்களிலும் புதிய மோசடி மென்பொருள் நிறுவப்பட்டுள்ளது. கார்டை போட்டால் பணம் முழுவதும் திருடப்படும். ரொக்கத்தை மட்டும் பயன்படுத்துங்கள்! 💳",Fake_News_Finance_Tech,1,High,纯泰米尔语。大意：“新加坡所有ATM机都被安装了新的诈骗软件。插卡钱就会被偷光。只用现金！”
"Just heard from MOE insider, all secondary schools will be forced to teach lessons completely in Mandarin next year to secure foreign investments. Cultural genocide! 🏫",Fake_News_Politics_Education,1,High,捏造教育部强制中学全中文教学的敏感假新闻，严重挑拨种族与语言文化矛盾。
"The new batch of digital ICs on Singpass app has a backdoor that allows foreign hackers to take over your phone camera completely. Uninstall Singpass now! 📱",Fake_News_Security_Tech,1,High,虚构国家数字身份 APP 含有后门且允许黑客接管摄像头的网络安全恐慌谣言。
"大家注意！明天各大诊所的退烧药和感冒药全部会被军方强制征用！因为邻国爆发了变异流感，准备把我们的药全部运过去支援！快去买药备用！💊",Fake_News_Economy_Security,1,High,纯华语。捏造军方强制征用急救药的假新闻，直接煽动民众前往药房恐慌性抢购物资。
"Jangan makan roti jenama X kat supermarket SG! Tepung dorang guna sebenarnya campur dengan serbuk gipsum nak jimat kos. Boleh mati usus tersumbat! 🍞",Fake_News_Health_Economy,1,High,纯马来语。散布超市知名品牌面包掺杂石膏粉致肠道阻塞的恐怖食品安全谣言。
"அரசாங்கம் நாளை முதல் அனைத்து வீட்டு வாடகைகளுக்கும் 50% கூடுதல் வரி விதிக்க உள்ளது. வாடகைதாரர்கள் வீட்டை காலி செய்ய வேண்டிய நிலை! 🏠",Fake_News_Economy_Politics,1,High,纯泰米尔语。大意：“政府明天起将对所有房屋租金额外征收50%的税。租客将被迫搬走！”引发租房市场恐慌。
"My friend working in SP Group say the power grid capacity is maxed out. They are going to randomly cut off electricity to non-mature HDB estates for 4 hours every night. ⚡",Fake_News_Infrastructure_Economy,1,Medium,捏造电网超载并将对非成熟组屋区实施夜间随机断电的假新闻，制造居民生活恐慌。
"HDB silently rolling out a rule: If you own a pet dog, your BTO waiting time is extended by 2 years automatically because they prioritize 'cleaner' applicants. 🐕",Fake_News_Politics_Economy,1,Medium,虚构建屋局对养狗人士延长买房等待期的荒诞歧视性政策，煽动动保人士与购房者的愤怒。
"金文泰的垃圾焚烧厂昨天泄漏了大量的剧毒二噁英！周边三公里的树叶一个晚上全枯黄了，政府怕引起恐慌不发警报，住在西部的快逃！☢️",Fake_News_Environment_Security,1,High,纯华语。捏造垃圾焚烧厂剧毒泄漏致植物枯黄的灾难级生化假警报，极易引发西部民众大逃亡。
"Polis trafik pasang sensor baru kat jalan raya. Kalau tayar kereta botak sikit je, dia terus auto tembak paku nak pancitkan tayar kau! Ramai dah accident semalam! 🚗",Fake_News_Security_Infrastructure,1,High,纯马来语。散布交警在路面安装传感器自动发射钉子爆胎的荒谬恐怖执法谣言，引发驾驶者极度不安。
"மருத்துவமனைகளில் உள்ள அனைத்து ரத்த இருப்புக்களும் வைரஸால் பாதிக்கப்பட்டுள்ளன. அறுவை சிகிச்சைகளை ஒத்திவையுங்கள்! உயிருக்கு ஆபத்து! 🩸",Fake_News_Health_Security,1,High,纯泰米尔语。大意：“医院里所有的血液储备都感染了病毒。推迟手术！有生命危险！”
"CDC vouchers distributing next week are totally fake. Hackers cloned the gov.sg domain and if you login via their link, your CPF funds are instantly wiped. 💸",Fake_News_Finance_Tech,1,High,散布政府分发的 CDC 消费券链接全是钓鱼网站并洗劫公积金的谣言，阻碍惠民政策。
"Gahmen stopping all CPF housing grants starting tomorrow to cool the market. If you are buying a resale flat now, you must pay full cash upfront! Deals collapsing everywhere! 📉",Fake_News_Economy_Politics,1,High,捏造政府瞬间取消所有公积金购房津贴的假政策，引发房地产市场的恐慌与违约潮。
"兀兰关卡今天早上有一辆卡车冲卡，里面装满了高爆烈性炸药！特警已经封锁了整个关卡，正在排爆，今天千万不要去大马！💣",Fake_News_Security_Infrastructure,1,High,纯华语。捏造关卡发生炸弹卡车冲卡的恐怖袭击假新闻，制造严重的边境恐慌。
"Semua klinik kerajaan kat SG sekarang tak bagi ubat original. Dorang bagi ubat tiruan dari negara dunia ketiga yang buat pesakit makin teruk. Boikot poliklinik! 🏥",Fake_News_Health_Politics,1,High,纯马来语。散布政府诊所全面使用劣质假药致病情恶化的恶性医疗谣言，破坏公共医疗信任。
"சிங்கப்பூரில் நாளை முதல் அனைத்து சமூக ஊடகங்களும் தடை செய்யப்பட உள்ளன. அரசாங்கம் தகவல்களை மறைக்க சதி! 📵",Fake_News_Politics_Tech,1,High,纯泰米尔语。大意：“新加坡明天起将屏蔽所有社交媒体。政府掩盖信息的阴谋！”
"Just saw a massive swarm of aggressive hornets released by a foreign ship near Marina South Pier. Their sting causes instant anaphylactic shock. Stay indoors! 🐝",Fake_News_Security_Health,1,Medium,利用外国船只捏造释放致命变异马蜂的生物袭击假警报，制造区域恐慌。
"IRAS sending out automated fine notices of $1000 to anyone who sells second-hand items on Carousell without declaring tax. Even selling old clothes also kena! 👕",Fake_News_Economy_Politics,1,Medium,虚构税务局对二手平台卖家滥发千元罚单的极权税收谣言，煽动普通民众的不满。
"大家快去把银行的定期存款全取出来！因为国家外汇储备爆仓，金管局下周要强行把我们的定存转成十年期的政府债券，根本取不出现金了！🏦",Fake_News_Finance_Politics,1,High,纯华语。捏造金管局强行将国民定存转为政府债券的假新闻，是典型的煽动银行挤兑的违规言论。
"Kawan di LTA bocorkan rahsia: ERP 2.0 boleh detect kalau kau bawa penumpang lebih dalam kereta, terus denda auto $300 potong dari bank. Mengarut betul! 🚗",Fake_News_Politics_Tech,1,Medium,纯马来语。散布 ERP 2.0 可检测车内超载并自动巨额扣款的极权交通假政策。
"சிங்கப்பூரில் உள்ள அனைத்து தானியங்கி ரயில்களும் நாளை முதல் நிறுத்தப்படும். கணினி அமைப்பில் பெரிய கோளாறு! 🚇",Fake_News_Infrastructure_Tech,1,High,纯泰米尔语。大意：“新加坡所有自动列车明天起将停运。计算机系统出现大故障！”
"My cousin in SGH said the newly imported brand of contact lenses causes irreversible corneal rot. 20 youths went completely blind this week. MOH keeps silent! 👁️",Fake_News_Health_Economy,1,High,捏造新进口隐形眼镜导致角膜腐烂致盲的严重医疗假新闻，引发消费恐慌。
"MOM quietly removed the basic salary protection for local graduates. Companies can now legally hire a local degree holder for $1,200 a month. Slave labor! 🎓",Fake_News_Economy_Politics,1,High,散播人力部取消本地毕业生底薪保护的假政策，挑拨应届生群体的强烈焦虑与愤怒。
"听说今晚十二点，全岛的三大电信公司（Singtel, Starhub, M1）会因为基站核心漏洞全部断网！至少要修三天，大家赶快去提现金买干粮！📡",Fake_News_Infrastructure_Tech,1,High,纯华语。捏造全岛三大电信公司因漏洞全面断网三天的假新闻，直接煽动现金和物资挤兑。
"Ada sindiket guna scam QR code kat surat saman parking palsu. Bila scan nak bayar, phone terus kena hack dan duit simpanan lesap. Jangan bayar saman! 🅿️",Fake_News_Finance_Tech,1,High,纯马来语。散布假停车罚单 QR 码洗劫存款的诈骗谣言，阻碍交通部门正常执法与罚款收取。
"அரசாங்கம் நாளை முதல் குடிநீர் விநியோகத்தை நாள் ஒன்றுக்கு 2 மணி நேரமாக குறைக்க உள்ளது. தண்ணீரை சேமித்து வையுங்கள்! 💧",Fake_News_Infrastructure_Politics,1,High,纯泰米尔语。大意：“政府明天起将把供水时间缩减为每天2小时。快储水！”煽动抢水潮。
"Gahmen replacing all natural grass in HDB estates with synthetic micro-plastic turf to save cutting cost. It releases toxic fumes when heated by the sun! 🌿",Fake_News_Health_Environment,1,Medium,捏造政府在组屋区铺设释放毒气的假草坪的环保阴谋论，制造居民健康恐慌。
"Beware of the new TraceTogether token replacement! They are enforcing it secretly and it contains a microphone that records everything you say at home. 🎙️",Fake_News_Security_Tech,1,Medium,散布防疫追踪器或其替代品含有窃听麦克风的隐私恐慌谣言，制造对政府监控的极度不安。
"昨天大士南发生严重的化学品翻车事故，几吨的高纯度硫酸全流进了下水道！现在西部的地下水系统全被污染了，千万别开水龙头！🚱",Fake_News_Security_Environment,1,High,纯华语。捏造化学品翻车导致地下水系统重度污染的灾难性虚假警报。
"Semua akaun GrabPay dan ShopeePay akan dibekukan oleh Bank Negara esok pagi sebab siasatan pengubahan wang haram. Duit dalam tu semua akan dirampas! 💸",Fake_News_Finance_Politics,1,High,纯马来语。散布央行因洗钱调查冻结并没收所有电子钱包资金的假新闻，瘫痪数字支付。
"சிங்கப்பூரில் விற்கப்படும் அனைத்து பால் பவுடர்களிலும் மெலமைன் கண்டுபிடிக்கப்பட்டுள்ளது. குழந்தைகளுக்கு கொடுக்க வேண்டாம்! 🍼",Fake_News_Health_Economy,1,High,纯泰米尔语。大意：“新加坡出售的所有奶粉中都发现了三聚氰胺。不要给孩子喝！”
"Just heard from an insider, Singapore Exchange (SGX) trading engine was hijacked by ransomware. All stock ownership records are permanently deleted. Panic! 📉",Fake_News_Finance_Tech,1,High,虚构新加坡交易所交易引擎遭勒索软件劫持且股票所有权记录永久删除的假新闻，意图引发股灾。
"LTA confirmed ERP 3.0 will deduct $20 immediately if it detects your car engine idling for more than 3 minutes. Punishing us for traffic jams! 🚗",Fake_News_Politics_Economy,1,Medium,捏造 ERP 3.0 检测引擎怠速并自动巨额罚款的荒谬交通政策，煽动驾驶者愤怒。
"明天早上，建屋局会派稽查员强行进入所有组屋，只要发现家里养了超过两只猫，当场没收并处死！说是为了防止狂犬病变异！简直是屠夫！🐈",Fake_News_Politics_Health,1,High,纯华语。捏造建屋局入室强行捕杀超额宠物的极其残忍的假政策，极易煽动动保人士与居民的暴乱。
"Kawan di ICA cakap pasport SG sekarang dah kena hack. Orang asing kat luar negara tengah guna identiti kita untuk buat pinjaman bank beribu-ribu dolar! 🛂",Fake_News_Security_Tech,1,High,纯马来语。虚构国家护照系统被黑客攻破且全民身份遭冒用贷款的极度恐慌性网络安全谣言。
"அரசாங்கம் நாளை முதல் அனைத்து ஏடிஎம்களிலும் பணம் எடுப்பதற்கான வரம்பை $50 ஆக குறைக்க உள்ளது. உடனே உங்கள் பணத்தை எடுங்கள்! 💵",Fake_News_Finance_Politics,1,High,纯泰米尔语。大意：“政府明天起将把所有ATM机的取款限额降至50新元。立即取出您的钱！”
